Sheet: Sheet1
A1: 111212 | B1: 2222 | C1: of:=([.A1]+[.B1]) -> 113434
A2: 111213 | B2: 2223 | C2: of:=([.A2]+[.B2]) -> 113436
A3: 111214 | B3: 2224 | C3: of:=([.A3]+[.B3]) -> 113438
A4: 111215 | B4: 2225 | C4: of:=([.A4]+[.B4]) -> 113440
A5: 111216 | B5: 2226 | C5: of:=([.A5]+[.B5]) -> 113442
A6: 111217 | B6: 2227 | C6: of:=([.A6]+[.B6]) -> 113444
A7: 111218 | B7: 2228 | C7: of:=([.A7]+[.B7]) -> 113446
A8: 111219 | B8: 2229 | C8: of:=([.A8]+[.B8]) -> 113448
A9: 111220 | B9: 2230 | C9: of:=([.A9]+[.B9]) -> 113450
A10: 111221 | B10: 2231 | C10: of:=([.A10]+[.B10]) -> 113452
A11: 111222 | B11: 2232 | C11: of:=([.A11]+[.B11]) -> 113454
A12: 111223 | B12: 2233 | C12: of:=([.A12]+[.B12]) -> 113456
A13: 111224 | B13: 2234 | C13: of:=([.A13]+[.B13]) -> 113458
A14: 111225 | B14: 2235 | C14: of:=([.A14]+[.B14]) -> 113460